<?xml version="1.0"?>
<!--
/**
 * Copyright Â© eComBricks. All rights reserved.
 * See LICENSE.txt for license details.
 */
-->
<config xmlns:xsi="http://www.w3.org/2001/XMLSchema-instance" xsi:noNamespaceSchemaLocation="urn:ecombricks:module:Ecombricks_Interception:etc/interception.xsd">
    <type name="Magento\Framework\Url">
        <property name="vendorParameterActionPathPatterns" type="array">
            <item name="adminMui">#^admin/mui#</item>
        </property>
    </type>
    <type name="Magento\Framework\View\Layout\Generator\UiComponent">
        <trait type="Ecombricks\Vendor\Framework\VendorTrait" sortOrder="-100" />
    </type>
    <type name="Magento\Framework\View\Element\UiComponentFactory">
        <trait type="Ecombricks\Vendor\Framework\VendorTrait" sortOrder="-100" />
    </type>
    <type name="Magento\Ui\DataProvider\Modifier\Pool">
        <trait type="Ecombricks\Vendor\Framework\VendorTrait" sortOrder="-100" />
    </type>
</config>